{
  "schema_version": "0.1",
  "case_id": "semg-joint-angle",
  "research_scope": {
    "schema_version": "0.1", "scope_id": "scope-semg", "mode": "exploratory",
    "description": "基于表面肌电预测人体关节角度，想了解 Transformer 和其他方法的研究情况。",
    "research_object": ["人体关节角度"], "input_modality": ["表面肌电"],
    "research_task": ["关节角度估计或预测"], "method": ["Transformer（方法分支，不限制探索检索）"],
    "application": [], "constraints": {},
    "unspecified": ["具体关节", "实时性", "预测时间跨度", "发表日期", "人群"]
  },
  "concept_groups": [
    {"group_id": "input", "role": "input", "label": "输入模态", "terms": ["surface electromyography", "sEMG"]},
    {"group_id": "object", "role": "object", "label": "研究对象", "terms": ["joint angle"]},
    {"group_id": "task", "role": "task", "label": "研究任务", "terms": ["estimation", "prediction"]},
    {"group_id": "method", "role": "method", "label": "方法分支", "terms": ["Transformer"]}
  ],
  "independent_relevance_set": null,
  "judgments": [],
  "notes": "宿主 Agent 的结构化输入示例，不是脚本自动翻译结果。组内词是待审候选；joint kinematics 比 joint angle 宽，未默认合并为同义组。本例没有人工真值集。"
}
